{
  "$schema": "../../../../../../../docs/packs/schema/about-unit.schema.json",
  "id": "u10",
  "notes": {
    "engoye": "Les vêtements: always plural for “clothes”.",
    "empale": "Un pantalon is singular in French, unlike English “trousers”.",
    "engatto": "Une chaussure, des chaussures.",
    "yange": "Mon or ma: ma chemise, mon chapeau.",
    "zange": "Mes: mes chaussures.",
    "eno": "Ce, cet or cette: ce pantalon, cette chemise.",
    "ngitwala": "Je le prends for a masculine thing, je la prends for a feminine one.",
    "nnaaba": "Je me lave: a reflexive verb.",
    "saizi": "For shoes, la pointure; for clothes, la taille."
  },
  "tips": { "u10s1": "porter-mettre", "u10s3": "ce-cette", "u10s4": "le-la-pronoun" },
  "guidebook": {
    "intro": "Talk about clothes, getting dressed and shopping. You’ll meet “this” in four forms and two verbs for wearing.",
    "tips": [
      {
        "id": "ce-cette",
        "title": "Ce, cet, cette, ces",
        "body": [
          "“This” or “that” agrees with the noun: **ce pantalon** (masculine), **cette chemise** (feminine), **ces chaussures** (plural). Before a masculine noun starting with a vowel, **cet**: **cet homme, cet été**."
        ],
        "table": [["Masculine", "Feminine", "Plural"], ["ce chapeau", "cette robe", "ces vêtements"], ["cet ami", "cette amie", "ces amis"]],
        "targetColumns": [0, 1, 2]
      },
      {
        "id": "porter-mettre",
        "title": "Porter, mettre, enlever",
        "body": [
          "**Porter** means to wear: **Je porte une robe.** **Mettre** means to put on: **Mets un pull.** **Enlever** means to take off: **Enlève tes chaussures.**",
          "**Je me lave** (I wash myself) uses **me**, because you do it to yourself. You’ll see many more of these verbs in the next unit."
        ]
      },
      {
        "id": "le-la-pronoun",
        "title": "Je la prends: “I’ll take it”",
        "body": [
          "To say “it”, French uses **le** or **la** before the verb, matching the noun: **cette chemise → Je la prends.** **ce pantalon → Je le prends.** Before a vowel: **Je l’aime.**",
          "Trying something on: **Essaie-le !** With the imperative, the pronoun comes after."
        ]
      }
    ],
    "culture": [
      {
        "title": "Pagne and boubou",
        "body": [
          "In West and Central Africa, printed cloth called **pagne** (wax) is sewn into dresses and shirts by a local tailor. The **boubou** is a long, flowing robe worn by men and women."
        ]
      }
    ]
  }
}
