{
  "$schema": "../../../../../../../docs/packs/schema/about-unit.schema.json",
  "id": "u6",
  "notes": { "ku-ddyo": "“Right” era kitegeeza “kituufu”, naye wano kitegeeza dyo." },
  "tips": { "u6s2": "going-to" },
  "guidebook": {
    "intro": "Manya ebifo mu kibuga n’enyumba, gamba gy’ogenda, era olage oba obuuze ekubo mu Lungereza.",
    "tips": [
      {
        "id": "going-to",
        "title": "“Going to”",
        "body": [
          "Mu Lusoga ogamba **Ŋŋenda ku somero**. Mu Lungereza ogamba **I am going to school**: **to** kiraga gy’ogenda.",
          "Naye ku waka, toteekako **to**: **I am going home.**"
        ]
      }
    ],
    "culture": [
      {
        "title": "Bodaboda",
        "body": [
          "Ekigambo **boda boda** kiva ku Lungereza “border to border”, kubanga pikipiki zaasooka okutwala abantu okusala ensalo. Atyanu kye kigambo kya Uganda n’Olungereza lwaayo."
        ]
      }
    ]
  }
}
