{
  "$schema": "../../../../../../../docs/packs/schema/about-unit.schema.json",
  "id": "u20",
  "notes": {
    "nja": "Bi- marks the future: abicito, I will go.",
    "wiikendi": "Literally “the end of the week”.",
    "nsuubira": "Geno is to trust or hope.",
    "ndoto": "Lek is a dream, asleep or awake."
  },
  "tips": { "u20s1": "bi-again", "u20s2": "let-us", "u20s3": "bi-again", "u20s4": "bi-again" },
  "guidebook": {
    "intro": "Make plans with **bi-** (will), and talk about **lek**, your dreams.",
    "tips": [
      {
        "id": "bi-again",
        "title": "Abicito, wabicito",
        "body": [
          "**Bi-** goes between the person and the verb: **abicito** (I will go), **ibicito** (you will go), **bibino** (he will come), **wabicito** (we will go)."
        ],
        "table": [
          ["Acholi", "English"],
          ["diki", "tomorrow"],
          ["agiki cabit", "the weekend"],
          ["cabit ma bino", "next week"],
          ["mwaka ma bino", "next year"],
          ["nino mo", "one day"]
        ],
        "targetColumns": [0]
      },
      {
        "id": "let-us",
        "title": "Wacit! Let’s go",
        "body": ["**Wa-** on a command means “let’s”: **Wacit** (let’s go), **Wacam** (let’s eat), **Watiy kacel** (let’s work together)."]
      }
    ],
    "culture": [
      {
        "title": "Visiting home",
        "body": ["Weekends and holidays are for going **paco**, home to the village, to visit grandparents and help in the garden."]
      }
    ]
  }
}
