{
  "$schema": "../../../../../../../docs/packs/schema/about-unit.schema.json",
  "id": "u14",
  "notes": {
    "ennimiro": "Shambani: on the farm.",
    "omulimi": "Many: wakulima.",
    "omufumbi": "From -pika, to cook. Many: wapishi.",
    "fundi": "Anyone skilled with their hands: fundi wa magari (mechanic), fundi cherehani (tailor).",
    "muuguzi": "Many: wauguzi.",
    "omusuubuzi": "Literally “one who does business”. Many: wafanyabiashara.",
    "anafanya": "With kazi: anafanya kazi, he or she works.",
    "ofiisi": "Ofisini: at the office."
  },
  "guidebook": {
    "intro": "Ask anyone in East Africa what they do and you may hear about two or three jobs at once. Learn to name jobs and say who does what.",
    "tips": [
      {
        "id": "job-words",
        "title": "Job words: m- and wa-",
        "body": [
          "Many words for people start with **m-** (one) and **wa-** (many), and several are built from a verb: **-lima** (farm) gives **mkulima**, **-pika** (cook) gives **mpishi**.",
          "Borrowed words like **dereva** and **askari** don’t change, but they still agree like people: **dereva wangu**, **askari wawili**."
        ]
      },
      {
        "id": "subject-prefixes",
        "title": "Who is doing it",
        "body": [
          "The front of a verb says who: **ni-** (I), **u-** (you), **a-** (he or she), **tu-** (we), **m-** (you all), **wa-** (they). Then comes the tense, **-na-** for now, then the verb.",
          "So **ninafanya** is “I do”, **anafanya** “she does” and **wanafanya** “they do”. Swahili has no separate word for “he” and “she”: **a-** is both."
        ],
        "table": [
          ["Who", "Works"],
          ["mimi", "ninafanya kazi"],
          ["wewe", "unafanya kazi"],
          ["yeye", "anafanya kazi"],
          ["sisi", "tunafanya kazi"],
          ["ninyi", "mnafanya kazi"],
          ["wao", "wanafanya kazi"]
        ],
        "targetColumns": [0, 1]
      }
    ],
    "culture": [
      {
        "title": "Jua kali",
        "body": [
          "In Kenya, **jua kali** (“hot sun”) is the name for the informal workers who build, weld and fix things in open-air workshops. A **fundi** there can mend almost anything."
        ]
      }
    ]
  },
  "glosses": {
    "sw-dream-job": {
      "1": { "kuwa": "to be" },
      "3": { "alikuwa": "he was" },
      "5": { "miaka": "years" },
      "7": { "Mtaka cha mvunguni sharti ainame": "a proverb: to get something, you must work for it" }
    }
  }
}
