{
  "$schema": "../../../../../../../docs/packs/schema/about-unit.schema.json",
  "id": "u1",
  "notes": {
    "oli-otya": "Friendly, to one person. To be polite or to a group: Comment allez-vous ?",
    "wasuze-otya": "French has no “how did you sleep?” greeting: Bonjour works all day until evening.",
    "osiibye-otya": "Used as a goodbye in the afternoon. To greet, Bonjour still works.",
    "gyebale-ko": "Said to someone who is working. Courage ! is also common.",
    "ggwe": "Tu when it’s the subject: Toi, tu es étudiant.",
    "lyange": "Mon before a masculine noun: mon nom. Ma before a feminine one: ma maison.",
    "lyo": "Ton before a masculine noun: ton nom. Ta before a feminine one.",
    "muyizi": "A woman says étudiante, with an extra -e.",
    "nsanyuse-okukulaba": "A woman writes enchantée; it sounds the same.",
    "shikamoo": "There’s no French word for this; Mes respects is old-fashioned and very polite."
  },
  "tips": { "u1s1": "tu-vous", "u1s2": "je-suis", "u1s3": "silent-letters" },
  "guidebook": {
    "intro": "French speakers greet before anything else, and they choose between a friendly “tu” and a polite “vous” from the very first word.",
    "tips": [
      {
        "id": "tu-vous",
        "title": "Tu or vous?",
        "body": [
          "French has two words for “you”. **Tu** is for one friend, a child or family: **Comment vas-tu ?** **Vous** is for someone you don’t know, an elder or a customer, and for any group: **Comment allez-vous ?**",
          "When in doubt, start with **vous**. People will tell you when to switch: **On peut se tutoyer**, “we can say tu”."
        ],
        "table": [
          ["Friendly (tu)", "Polite (vous)", "English"],
          ["Comment vas-tu ?", "Comment allez-vous ?", "How are you?"],
          ["Salut !", "Bonjour, madame.", "Hello"],
          ["Merci.", "Merci beaucoup, monsieur.", "Thank you"]
        ],
        "targetColumns": [0, 1]
      },
      {
        "id": "je-suis",
        "title": "Je suis, je m’appelle",
        "body": [
          "**Je suis** means “I am”: **Je suis étudiant.** For your name, French says “I call myself”: **Je m’appelle Nakato.** To ask, **Comment tu t’appelles ?**",
          "**Je** becomes **j’** before a vowel: **j’habite** (I live), **j’ai** (I have). This apostrophe shortening, the elision, happens all over French."
        ]
      },
      {
        "id": "silent-letters",
        "title": "Many final letters are silent",
        "body": [
          "French spelling keeps letters it no longer says. The **-s** of **vas**, the **-t** of **vingt**, the **-e** of **madame** are silent. **Deux** sounds like “duh”, **trois** like “trwa”.",
          "Numbers to ten: **un, deux, trois, quatre, cinq, six, sept, huit, neuf, dix**. Before a vowel, some silent letters wake up: **deux amis** is said “duh-zami”."
        ]
      }
    ],
    "culture": [
      {
        "title": "Bonjour, madame",
        "body": [
          "In shops, offices and buses, say **Bonjour** before anything else, often with **monsieur** or **madame**. Asking a question without a greeting can seem rude."
        ]
      },
      {
        "title": "La bise",
        "body": [
          "Friends and family often greet with light kisses on the cheeks, **la bise**. The number of kisses depends on the country and even the town; a handshake is always fine with someone new."
        ]
      }
    ]
  }
}
