{
  "$schema": "../../../../../../../docs/packs/schema/about-unit.schema.json",
  "id": "u6",
  "notes": { "liri-wa": "For li- class nouns like eddwaliro and essomero.", "s-jjajja-ku-kyalo": "a- means he or she: abeera, she lives." },
  "tips": { "u6s2": "going-to" },
  "glosses": { "boda-ride": { "4": { "ssatu": "three (nkumi ssatu: 3,000)" }, "6": { "Ndaga": "show me", "ekkubo": "road, way" } } },
  "guidebook": {
    "intro": "Getting around means boda bodas, taxis and asking the way. A few direction words go a long way.",
    "tips": [
      {
        "id": "going-to",
        "title": "Ŋŋenda: the letter ŋ",
        "body": [
          "**Ŋ** sounds like the “ng” in “sing”. **Ŋŋenda** (I am going) starts with a long ŋ. If your keyboard has no ŋ, typing **ng** is accepted.",
          "Use **ku** for going to a place you visit (**ku ssomero**, to school) and **mu** for going into a place (**mu kibuga**, into town). **Awaka** (home) needs neither."
        ]
      },
      {
        "id": "where-is",
        "title": "Where is it?",
        "body": [
          "“Is” agrees with the noun class again. Nouns like **eddwaliro** and **essomero** take **liri wa?**, and ki- nouns take **kiri wa?**: **Ekitabo kiri wa?** (Where is the book?)."
        ]
      }
    ],
    "culture": [
      {
        "title": "Boda bodas",
        "body": [
          "Motorbike taxis, **boda bodas**, are the quickest way through traffic. Agree the price before you get on, ask for a helmet, and say **Yimirira wano** when you arrive."
        ]
      }
    ]
  }
}
